{
  "$schema": "https://json-schema.org/draft/2020-12/schema",
  "$id": "https://implementaudit.local/schema/operational-evidence-v1.json",
  "x-implementaudit-schema": "implementaudit-operational-evidence-schema-v1",
  "x-canonicalisation": {
    "identity": "canonical_json_v1",
    "encoding": "UTF-8",
    "bom": false,
    "object_keys": "recursive_lexicographic",
    "array_order": "declared_semantic_order",
    "insignificant_whitespace": false,
    "string_rewriting": false
  },
  "x-payload-normalisation": {
    "identity": "canonical_payload_text_v1",
    "line_endings": "CRLF_and_CR_to_LF",
    "trailing_lf": "remove_all",
    "other_whitespace": "preserve",
    "unicode": "preserve"
  },
  "x-repository-only-observation": {
    "schema": "implementaudit-repository-snapshot-v1",
    "domain": "IA-OPERATIONAL-REPOSITORY-SNAPSHOT-v1",
    "snapshot_id": "iarepo-v1-<canonical_input_manifest_sha256>",
    "commands": [
      "scan <repository>",
      "inspect <snapshot>"
    ],
    "scope": "REPOSITORY_ONLY",
    "aggregate": "DEGRADED",
    "unacquired_families": [
      "OWNERSHIP",
      "EXECUTION",
      "EVIDENCE",
      "FAILURE",
      "RELEASE"
    ],
    "identity_inputs": [
      "schema_sha256",
      "compiler_sha256",
      "query_policy_sha256",
      "collection_sha256",
      "input_profile"
    ],
    "query_diff_render_population": "same_collector_projection_as_native_snapshots",
    "native_authentication": false,
    "native_override": false,
    "pointer_publication": false,
    "file_inspection_authority": "REPOSITORY_ONLY_UNAUTHENTICATED_FILE",
    "secure_file_reader_platform": "POSIX_nonfollowing_handles_or_Windows_fixed_local_drive_handle_relative_no_reparse",
    "unsupported_reader_platform": "typed_refusal_or_PARTIAL_file_facts",
    "input_ceilings": {
      "files": 4096,
      "file_bytes": 16777216,
      "total_bytes": 134217728,
      "python_bytes": 1048576
    }
  },
  "x-captured-owner-observation": {
    "schema": "implementaudit-captured-owner-snapshot-v1",
    "domain": "IA-CAPTURED-OWNER-SNAPSHOT-v1",
    "snapshot_id": "iacapture-v1-<canonical_input_manifest_sha256>",
    "commands": ["capture <kind> <input>", "inspect <snapshot>"],
    "scope": "CAPTURED_OWNER",
    "aggregate": "DEGRADED",
    "record_currentness": "UNVERIFIED",
    "authority_ceiling": "READ_ONLY_OBSERVATION",
    "input": "explicit_bounded_nonaliased_UTF8_JSON_file",
    "retention": "exact_input_text_and_SHA256_plus_derived_full_member_projection",
    "native_locator_access": false,
    "hidden_refresh": false,
    "model_invocations": 0,
    "pointer_publication": false,
    "native_authentication": false,
    "establishes": [],
    "kinds": ["pending", "pending-decision", "route", "route-result", "host-binding", "result-occurrence", "member-coverage", "child-visibility", "public-census"],
    "input_ceilings": {"bytes": 8388608, "projected_records": 16384, "snapshot_bytes": 16777216},
    "pending_predicate": "version > consumed_version; no epoch or currentness requirement",
    "pending_bindings": "available_R_A_scope_cutoff_policy_assignment_and_exact_episode_value",
    "route_bindings": "exact_action_child_packet_and_logical_task_identity",
    "occurrence_ceilings": {"result_member_obligation_bytes": 1048576, "candidate_Q_E_custody_bytes": 2097152},
    "preparation_bindings": "complete_declaration_group_holders_dependencies_predecessors_and_guards",
    "product_bindings": "supplied_local_shapes_and_identities_only; exact_product_authority_bytes_remain_missing",
    "public_census_input": "implementaudit.public-census-input.v1",
    "public_membership": "declared_tracker_only_not_admission_or_original_properties",
    "missing_native_receiving_and_owner_formats": "explicit_omission_census"
  },
  "x-native-current-facts": {
    "schema": "implementaudit-native-current-facts-v1",
    "authority_ceiling": "READ_ONLY_NATIVE_CURRENT_FACT",
    "fixed_hot_paths": ["STATE.md", "ROADMAP.md", "WORK_GRAPH.json"],
    "currentness_chain": [
      "controller",
      "claim",
      "generation_pointer",
      "receipt_v3",
      "immediate_predecessor",
      "migration_marker",
      "route_record"
    ],
    "predecessor_predicate": "canonical_R0011_read_only_currentness_and_exact_immediate_v2_v3",
    "predecessor_validator_execution": {
      "mode": "child_loaded_byte_bound_private_materialization",
      "closure": ["claim-run.sh", "validate-run-root.sh"],
      "child_binding": "completed_child_reports_exact_sha256_pair",
      "environment": "exact_allowlist_without_inherited_python_loader_or_module_overrides",
      "cleanup": "exact_members_or_typed_residue_with_manual_reconciliation"
    },
    "route_predicate": "canonical_R0033_pure_read_only_currentness",
    "route_semantic_fence": "canonical_R0033_recheck_with_fresh_controller_and_final_route_controller_ref_pair",
    "graph_projection": "implementaudit.work-graph.v1",
    "graph_compiler_execution": "byte_bound_and_finally_fenced",
    "publication": false,
    "activegraph_authority": false
  },
  "x-native-current-facts-v2": {
    "schema": "implementaudit-native-current-facts-v2",
    "inherits": "x-native-current-facts",
    "canonical_work_graph": "exact_UTF8_canonical_WORK_GRAPH_bytes_bound_to_hot_digest",
    "route_graph": "R0035_native_work_graph_with_complete_declared_node_population",
    "route_relation": "R0035_binding_of_canonical_graph_to_R0033_current_scope_export",
    "source_selection": "fixed_same_checkout_source_peers_no_caller_override",
    "route_source": "R0033_current_obligation_transaction_scope_and_receipt",
    "affected_nodes": "R0035_direct_scope_required_optional_dependents_and_ancestors",
    "independent_nodes": "retained_separately_without_global_route_digest_in_node_identity",
    "uncovered_scopes": "explicit_UNVERIFIED_capability_and_omission_rows",
    "missing_peer_capability": "both_route_graph_and_route_relation_null_with_UNVERIFIED_omission",
    "partial_peer_capability": "typed_refusal",
    "frozen_validation": "fixed_byte_bound_pure_owner_contract_no_native_refresh",
    "legacy_facts_v1": "preserved_bytes_with_query_time_UNVERIFIED_mapping_omission",
    "authority_ceiling": "READ_ONLY_NATIVE_CURRENT_FACT",
    "establishes": []
  },
  "x-native-current-facts-v3": {
    "schema": "implementaudit-native-current-facts-v3",
    "inherits": "x-native-current-facts-v2",
    "native_episode": "optional_fixed_owner_export_with_producer_and_pure_contract_source_digests",
    "producer": "compaction-audit-pending.py.acquire_selected_episode_export_v1_no_arguments",
    "frozen_validator": "compaction-result-observation.py.validate_frozen_episode_export_v1_no_IO",
    "selected_scope": "exact_C03_route_and_R0035_host_controller_claim_run_continuity_obligation_transaction",
    "cutoffs": "original_immutable_C_Q_E_and_selected_occurrence_prefixes_never_live_EOF",
    "unavailable": "explicit_UNVERIFIED_capability_and_omission_census",
    "invalid_bound_record": "typed_refusal_never_absence",
    "captured_input_upgrade": false,
    "h0_lifecycle": "separate_typed_receipts_or_explicit_UNVERIFIED",
    "authority_ceiling": "READ_ONLY_NATIVE_CURRENT_FACT",
    "establishes": []
  },
  "x-bounded-history-query": {
    "schema": "implementaudit.operational-evidence-query.v1",
    "cursor_schema": "implementaudit.history-query-cursor.v1",
    "history_contract": "implementaudit.history-query.v1",
    "authority_ceiling": "READ_ONLY_OBSERVATION",
    "cursor_integrity": "sha256_checksum_not_authentication",
    "cursor_pages": "never_decision_usable",
    "decision_page": "untruncated_first_page_from_filter_start_only",
    "overflow": "OE_QUERY_REQUIRES_BOUNDED_REVIEW",
    "history_discovery": "verified_current_pointer_manifest_predecessor_chain_only",
    "activegraph_authority": false,
    "publication": false
  },
  "x-bounded-snapshot-diff-export": {
    "diff_schema": "implementaudit-operational-snapshot-diff.v1",
    "export_schema": "implementaudit-operational-snapshot-export.v1",
    "projection_schema": "implementaudit-operational-snapshot-projection.v1",
    "payload_schema": "implementaudit-operational-snapshot-payload.v2",
    "semantic_identity": "record_id_plus_explicit_snapshot_fields",
    "canonical_json_export": "canonical_json_v1(snapshot)",
    "projection_formats": ["table", "graph"],
    "projection_encoding": "canonical_json_v1_inert_data",
    "bounds": "finite_positive_rows_and_record_bytes",
    "overflow": "OE_EXPORT_REQUIRES_BOUNDED_REVIEW",
    "destination": "explicit_absolute_new_file_under_isolated_owned_root",
    "authority_ceiling": "READ_ONLY_OBSERVATION_OR_EXPLICIT_TASK_OWNED_DESTINATION_ONLY",
    "activegraph_authority": false,
    "publication": false
  },
  "x-immutable-snapshot-publication": {
    "schema": "IA-OPERATIONAL-SNAPSHOT-v1",
    "input_schema": "implementaudit-operational-snapshot-input.v1",
    "payload_schema": "implementaudit-operational-snapshot-payload.v2",
    "current_schema": "implementaudit.operational-snapshot-current.v1",
    "snapshot_id": "iasnap-v1-<sha256_canonical_identity_record>",
    "identity_record": ["domain", "encoding", "canonicalisation", "semantic_payload_sha256", "canonical_input_manifest_sha256", "schema_sha256", "compiler_contract_sha256", "compiler_blob_sha256"],
    "embedded_input_manifest": "exact_collector_population_and_native_tuple_recomputed_by_frozen_reader",
    "legacy_payload_v1": "UNBOUND_IDENTITY_REFUSED_RECOMPILE_FROM_ENTITLED_INPUTS_REQUIRED",
    "output_root": "<native-bound-run-root>/operational-evidence/snapshots",
    "writer": "single_output_root_writer_before_native_derivation_through_readback",
    "manifest_keys": ["schema_version", "controller_id", "claim_id", "run_id", "source_epoch", "source_pointer_oid", "source_evidence_entries"],
    "current_keys": ["schema_version", "snapshot_id", "manifest_sha256", "source_pointer_oid"],
    "publication": "immutable_materialization_then_atomic_CURRENT_replace",
    "input_fence": "compiler_schema_native_route_graph_collectors_and_prior_CURRENT",
    "volatile_envelope": "excluded_from_semantic_identity",
    "invalid": "never_advances_CURRENT",
    "degraded": "retains_complete_missing_or_omitted_state",
    "authority_ceiling": "R0038_OUTPUT_ROOT_ONLY"
  },
  "title": "IMPLEMENTAUDIT operational evidence v1",
  "type": "object",
  "additionalProperties": false,
  "required": [
    "schema",
    "aggregate",
    "families",
    "affected_families",
    "capability_declarations",
    "currentness_predicates",
    "entities",
    "relations",
    "payload_records"
  ],
  "properties": {
    "schema": {"const": "implementaudit-operational-evidence-v1"},
    "aggregate": {"enum": ["COMPLETE", "DEGRADED", "STALE", "INVALID", "SUPERSEDED"]},
    "families": {
      "type": "array",
      "prefixItems": [
        {"const": "CODE"},
        {"const": "OWNERSHIP"},
        {"const": "EXECUTION"},
        {"const": "EVIDENCE"},
        {"const": "FAILURE"},
        {"const": "RELEASE"}
      ],
      "items": false,
      "minItems": 6,
      "maxItems": 6
    },
    "affected_families": {"type": "array", "items": {"$ref": "#/$defs/family"}, "uniqueItems": true},
    "capability_declarations": {"type": "array", "items": {"$ref": "#/$defs/capability"}},
    "currentness_predicates": {"type": "array", "items": {"$ref": "#/$defs/predicate"}},
    "entities": {"type": "array", "items": {"$ref": "#/$defs/entity"}},
    "relations": {"type": "array", "items": {"$ref": "#/$defs/relation"}},
    "payload_records": {"type": "array", "items": {"$ref": "#/$defs/payload"}}
  },
  "$defs": {
    "family": {"enum": ["CODE", "OWNERSHIP", "EXECUTION", "EVIDENCE", "FAILURE", "RELEASE"]},
    "state": {"enum": ["CURRENT", "UNKNOWN", "UNSUPPORTED", "STALE", "UNVERIFIED", "CONTRADICTORY", "PARSER_ERROR", "INVALID"]},
    "layer": {"enum": ["repository", "git", "planning", "controller", "execution", "evidence", "failure", "package", "install", "host", "ci", "release", "external", "public"]},
    "source_identity": {
      "type": "object",
      "additionalProperties": false,
      "required": ["id", "layer"],
      "properties": {
        "id": {"type": "string", "minLength": 1},
        "layer": {"$ref": "#/$defs/layer"}
      }
    },
    "currentness": {
      "type": "object",
      "additionalProperties": false,
      "required": ["state", "invalidators"],
      "properties": {
        "state": {"$ref": "#/$defs/state"},
        "invalidators": {"type": "array", "items": {"type": "string", "minLength": 1}, "uniqueItems": true}
      }
    },
    "capability": {
      "type": "object",
      "additionalProperties": false,
      "required": ["id", "family", "native_owner_identity", "source_identity", "evidence_layer", "currentness", "supported", "reason_code"],
      "properties": {
        "id": {"type": "string", "minLength": 1},
        "family": {"$ref": "#/$defs/family"},
        "native_owner_identity": {"type": "string", "minLength": 1},
        "source_identity": {"$ref": "#/$defs/source_identity"},
        "evidence_layer": {"$ref": "#/$defs/layer"},
        "currentness": {"$ref": "#/$defs/currentness"},
        "supported": {"type": "boolean"},
        "reason_code": {"type": "string", "minLength": 1}
      }
    },
    "predicate": {
      "type": "object",
      "additionalProperties": false,
      "required": ["id", "family", "native_owner_identity", "source_identity", "evidence_layer", "currentness", "predicate", "input_sha256"],
      "properties": {
        "id": {"type": "string", "minLength": 1},
        "family": {"$ref": "#/$defs/family"},
        "native_owner_identity": {"type": "string", "minLength": 1},
        "source_identity": {"$ref": "#/$defs/source_identity"},
        "evidence_layer": {"$ref": "#/$defs/layer"},
        "currentness": {"$ref": "#/$defs/currentness"},
        "predicate": {"type": "string", "minLength": 1},
        "input_sha256": {"type": "string", "pattern": "^[0-9a-f]{64}$"}
      }
    },
    "entity": {
      "type": "object",
      "additionalProperties": false,
      "required": ["id", "family", "record_type", "native_owner_identity", "source_identity", "evidence_layer", "currentness", "required"],
      "properties": {
        "id": {"type": "string", "minLength": 1},
        "family": {"$ref": "#/$defs/family"},
        "record_type": {"enum": ["Repository", "Commit", "Tree", "Worktree", "File", "Symbol", "Package", "GeneratedArtifact", "Controller", "CustodyClaim", "Receipt", "Run", "Phase", "WorkItem", "Writer", "Resource", "Claim", "Criterion", "Evidence", "Check", "Review", "Andon", "Residual", "Countermeasure", "Issue", "PullRequest", "WorkflowRun", "Release", "Tag", "Asset", "Install", "PublicSurface"]},
        "native_owner_identity": {"type": "string", "minLength": 1},
        "source_identity": {"$ref": "#/$defs/source_identity"},
        "evidence_layer": {"$ref": "#/$defs/layer"},
        "currentness": {"$ref": "#/$defs/currentness"},
        "required": {"type": "boolean"}
      }
    },
    "relation": {
      "type": "object",
      "additionalProperties": false,
      "required": ["id", "family", "relation_type", "source_entity_id", "target_entity_id", "native_owner_identity", "source_identity", "evidence_layer", "currentness", "confidence", "inference_rule"],
      "properties": {
        "id": {"type": "string", "minLength": 1},
        "family": {"$ref": "#/$defs/family"},
        "relation_type": {"enum": ["OWNS", "WRITES", "GENERATES", "PACKAGES", "INSTALLS", "CONSUMES", "DEPENDS_ON", "BLOCKS", "READY_WHEN", "SERIALISES_WITH", "JOINS", "CLAIMS", "EVIDENCES", "CONTRADICTS", "INVALIDATES", "SUPERSEDES", "FAILED_AT", "CONTAINED_BY", "REPAIRED_BY", "VERIFIED_BY", "RECOVERED_TO", "QUALIFIES", "MERGES_TO", "TAGS", "PUBLISHES", "READ_BACK_AS"]},
        "source_entity_id": {"type": "string", "minLength": 1},
        "target_entity_id": {"type": "string", "minLength": 1},
        "native_owner_identity": {"type": "string", "minLength": 1},
        "source_identity": {"$ref": "#/$defs/source_identity"},
        "evidence_layer": {"$ref": "#/$defs/layer"},
        "currentness": {"$ref": "#/$defs/currentness"},
        "confidence": {"enum": ["mechanical", "declared", "inferred"]},
        "inference_rule": {"type": ["string", "null"]}
      }
    },
    "payload": {
      "type": "object",
      "additionalProperties": false,
      "required": ["id", "family", "native_owner_identity", "source_identity", "evidence_layer", "currentness", "media_type", "payload", "payload_sha256"],
      "properties": {
        "id": {"type": "string", "minLength": 1},
        "family": {"$ref": "#/$defs/family"},
        "native_owner_identity": {"type": "string", "minLength": 1},
        "source_identity": {"$ref": "#/$defs/source_identity"},
        "evidence_layer": {"$ref": "#/$defs/layer"},
        "currentness": {"$ref": "#/$defs/currentness"},
        "media_type": {"type": "string", "minLength": 1},
        "payload": {"type": "string"},
        "payload_sha256": {"type": "string", "pattern": "^[0-9a-f]{64}$"}
      }
    }
  }
}
