{
  "schema": "implementaudit-operational-evidence-v1",
  "aggregate": "DEGRADED",
  "families": ["CODE", "OWNERSHIP", "EXECUTION", "EVIDENCE", "FAILURE", "RELEASE"],
  "affected_families": ["CODE"],
  "capability_declarations": [],
  "currentness_predicates": [],
  "entities": [
    {
      "id": "entity:duplicate",
      "family": "CODE",
      "record_type": "Repository",
      "native_owner_identity": "git:repository",
      "source_identity": {"id": "tree:one", "layer": "repository"},
      "evidence_layer": "repository",
      "currentness": {"state": "CURRENT", "invalidators": []},
      "required": false
    },
    {
      "id": "entity:duplicate",
      "family": "CODE",
      "record_type": "File",
      "native_owner_identity": "git:repository",
      "source_identity": {"id": "file:two", "layer": "repository"},
      "evidence_layer": "repository",
      "currentness": {"state": "CURRENT", "invalidators": []},
      "required": false
    }
  ],
  "relations": [],
  "payload_records": []
}
